607;Nouveau-né, poids de naissance 1 250-1 499 g avec syndrome de détresse respiratoire, autre anomalie respiratoire majeure ou autre anomalie majeure;15;Nouveau-nés, affections d'origine périnatale;Médical;303;0
608;Nouveau-né, poids de naissance 1 250-1 499 g avec ou sans autre affection significative;15;Nouveau-nés, affections d'origine périnatale;Médical;141;0
609;Nouveau-né, poids de naissance 1 500-2 499 g avec procédure majeure;15;Nouveau-nés, affections d'origine périnatale;Chirurgical;60;0
611;Nouveau-né, poids de naissance 1 500-1 999 g avec anomalie majeure;15;Nouveau-nés, affections d'origine périnatale;Médical;183;0
612;Nouveau-né, poids de naissance 1 500-1 999 g avec syndrome de détresse respiratoire ou autre affection respiratoire majeure;15;Nouveau-nés, affections d'origine périnatale;Médical;326;0
613;Nouveau-né, poids de naissance 1 500-1 999 g avec infection congénitale ou périnatale;15;Nouveau-nés, affections d'origine périnatale;Médical;56;0
614;Autre nouveau-né, poids de naissance 1 500-1 999 g avec ou sans autre affection significative;15;Nouveau-nés, affections d'origine périnatale;Médical;425;0
621;Nouveau-né, poids de naissance 2 000-2 499 g avec anomalie majeure;15;Nouveau-nés, affections d'origine périnatale;Médical;154;0
622;Nouveau-né, poids de naissance 2 000-2 499 g avec syndrome de détresse respiratoire ou autre affection respiratoire majeure;15;Nouveau-nés, affections d'origine périnatale;Médical;272;0
623;Nouveau-né, poids de naissance 2 000-2 499 g avec infection congénitale ou périnatale;15;Nouveau-nés, affections d'origine périnatale;Médical;63;0
625;Nouveau-né, poids de naissance 2 000-2 499 g, né sur place, avec autre affection significative;15;Nouveau-nés, affections d'origine périnatale;Médical;278;0
626;Nouveau-né, poids de naissance 2 000-2 499 g, normal ou nouveau-né avec autre problème;15;Nouveau-nés, affections d'origine périnatale;Médical;427;< 5
630;Nouveau-né, poids de naissance > 2 499 g avec procédure cardiovasculaire majeure;15;Nouveau-nés, affections d'origine périnatale;Chirurgical;99;0
631;Nouveau-né, poids de naissance > 2 499 g avec autre procédure majeure;15;Nouveau-nés, affections d'origine périnatale;Chirurgical;112;< 5
633;Nouveau-né, poids de naissance > 2 499 g avec anomalie majeure;15;Nouveau-nés, affections d'origine périnatale;Médical;468;0
634;Nouveau-né, poids de naissance > 2 499 g avec syndrome de détresse respiratoire ou autre affection respiratoire majeure;15;Nouveau-nés, affections d'origine périnatale;Médical;682;0
636;Nouveau-né, poids de naissance > 2 499 g avec infection congénitale ou périnatale;15;Nouveau-nés, affections d'origine périnatale;Médical;270;0
639;Nouveau-né, poids de naissance > 2 499 g avec autre affection significative;15;Nouveau-nés, affections d'origine périnatale;Médical;738;0
640;Nouveau-né, poids de naissance > 2 499 g, normal et avec autres problèmes;15;Nouveau-nés, affections d'origine périnatale;Médical;2.093;12
650;Splénectomie;16;Sang et organes hématopoïétiques;Chirurgical;190;0
651;Autres procédures concernant le sang et les organes hématopoïétiques;16;Sang et organes hématopoïétiques;Chirurgical;879;818
660;Diagnostics hématologiques et immunologiques majeurs excepté crise drépanocytaire et coagulation;16;Sang et organes hématopoïétiques;Médical;3.925;4.541
661;Troubles de la coagulation et des plaquettes;16;Sang et organes hématopoïétiques;Médical;1.206;1.630
662;Crise d'anémie à cellules falciformes;16;Sang et organes hématopoïétiques;Médical;736;80
663;Autres anémies et troubles sanguins, troubles des organes hématopoïétiques;16;Sang et organes hématopoïétiques;Médical;10.230;18.277
680;Procédures opératoires majeures pour néoplasie lymphatique, hématopoïétique ou autre;17;Maladies myéloprolifératives, néoplasmes peu différenciés;Chirurgical;962;37
681;Autres procédures opératoires pour néoplasie lymphatique, hématopoïétique ou autre;17;Maladies myéloprolifératives, néoplasmes peu différenciés;Chirurgical;3.776;1.426
690;Leucémie aiguë;17;Maladies myéloprolifératives, néoplasmes peu différenciés;Médical;1.041;3.808
691;Lymphome, myélome et leucémie non aiguë;17;Maladies myéloprolifératives, néoplasmes peu différenciés;Médical;3.589;8.144
692;Radiothérapie;17;Maladies myéloprolifératives, néoplasmes peu différenciés;Médical;548;327
694;Affections malignes lymphatiques et autres et néoplasmes de comportement incertain;17;Maladies myéloprolifératives, néoplasmes peu différenciés;Médical;2.685;14.238
695;Chimiothérapie pour leucémie aiguë;17;Maladies myéloprolifératives, néoplasmes peu différenciés;Médical;1.178;6.833
696;Autre chimiothérapie;17;Maladies myéloprolifératives, néoplasmes peu différenciés;Médical;22.347;391.108
710;Infections et maladies parasitaires incluant le HIV avec procédure opératoire;18;Maladies infectieuses et parasitaires;Chirurgical;2.882;108
711;Infections post-opératoires, post-traumatiques ou d'autre matériel avec procédure opératoire;18;Maladies infectieuses et parasitaires;Chirurgical;2.174;343
720;Septicémie et infections disséminées;18;Maladies infectieuses et parasitaires;Médical;12.341;12
721;Infections post-opératoires, post-traumatiques ou d'autre matériel;18;Maladies infectieuses et parasitaires;Médical;3.974;358
722;Fièvre;18;Maladies infectieuses et parasitaires;Médical;3.683;30
723;Maladie virale;18;Maladies infectieuses et parasitaires;Médical;9.247;51
724;Autres maladies infectieuses et parasitaires;18;Maladies infectieuses et parasitaires;Médical;3.385;370
740;Diagnostic de maladie mentale avec procédure opératoire;19;Troubles mentaux;Chirurgical;776;47
750;Schizophrénie;19;Troubles mentaux;Médical;637;< 5
751;Troubles dépressifs majeurs et psychoses autres ou non spécifiées;19;Troubles mentaux;Médical;2.596;1.841
752;Troubles de la personnalité et du contrôle des impulsions;19;Troubles mentaux;Médical;410;< 5
753;Troubles bipolaires;19;Troubles mentaux;Médical;1.401;342
754;Dépression, excepté trouble dépressif majeur;19;Troubles mentaux;Médical;2.860;137
755;Troubles de l'ajustement et névroses, excepté diagnostics dépressifs;19;Troubles mentaux;Médical;2.677;125
756;États d'anxiété et de délire aigus;19;Troubles mentaux;Médical;3.889;20
757;Troubles organiques de la santé mentale;19;Troubles mentaux;Médical;4.969;142
758;Troubles comportementaux;19;Troubles mentaux;Médical;626;33
759;Troubles de la nutrition;19;Troubles mentaux;Médical;290;8
760;Autres troubles de la santé mentale;19;Troubles mentaux;Médical;4.680;376
770;Abus d'alcool et de drogues avec dépendance, sortie contre avis médical;20;Alcoolisme et usage de drogue;Médical;633;< 5
772;Dépendance à l'alcool et aux drogues avec revalidation ou revalidation et désintoxication;20;Alcoolisme et usage de drogue;Médical;1.520;< 5
773;Abus d'opiacés et dépendance;20;Alcoolisme et usage de drogue;Médical;579;< 5
774;Abus de cocaïne et dépendance;20;Alcoolisme et usage de drogue;Médical;484;< 5
775;Abus d'alcool et dépendance;20;Alcoolisme et usage de drogue;Médical;8.928;70
776;Abus d'autres drogues et dépendance;20;Alcoolisme et usage de drogue;Médical;912;6
791;Procédures opératoires pour autres complications de traitement;21;Traumatismes, empoisonnements, effets toxiques des médicaments;Chirurgical;4.381;1.569
811;Réactions allergiques;21;Traumatismes, empoisonnements, effets toxiques des médicaments;Médical;1.383;9
812;Empoisonnement par agents médicamenteux;21;Traumatismes, empoisonnements, effets toxiques des médicaments;Médical;10.933;36
813;Autres complications de traitement;21;Traumatismes, empoisonnements, effets toxiques des médicaments;Médical;5.017;1.184
815;Autres diagnostics de blessure, empoisonnement, effets toxiques;21;Traumatismes, empoisonnements, effets toxiques des médicaments;Médical;2.576;62
816;Effets toxiques de substances non médicamenteuses;21;Traumatismes, empoisonnements, effets toxiques des médicaments;Médical;1.902;23
841;Brûlures extensives du troisième degré avec greffe de peau;22;Brûlures;Chirurgical;16;0
842;Brûlures avec greffe de peau excepté brûlures extensives du troisième degré;22;Brûlures;Chirurgical;282;61
843;Brûlures extensives du troisième degré ou de « l'épaisseur totale » sans greffe de peau;22;Brûlures;Médical;14;< 5
844;Brûlures de « l'épaisseur partielle » sans greffe de peau;22;Brûlures;Médical;766;56
850;Procédure avec diagnostic de rééducation, suites de soins ou autre contact avec les services de santé;23;Facteurs influençant la santé;Chirurgical;11.119;36.398
860;Rééducation;23;Facteurs influençant la santé;Médical;11.885;12
861;Signes, symptômes et autres facteurs influençant l'état de santé;23;Facteurs influençant la santé;Médical;36.785;242.780
862;Autre suivi de soins et convalescence;23;Facteurs influençant la santé;Médical;20.800;69.076
863;Suivi de soins néonatal;23;Facteurs influençant la santé;Médical;989;13
890;HIV avec affections majeures multiples en rapport avec le HIV;24;Infections HIV;Médical;161;0
892;HIV avec une affection majeure en rapport avec le HIV;24;Infections HIV;Médical;265;118
893;HIV avec affections significatives multiples en rapport avec le HIV;24;Infections HIV;Médical;56;0
894;HIV avec une seule ou aucune affection significative en rapport avec le HIV;24;Infections HIV;Médical;348;110
910;Craniotomie pour polytraumatisme significatif;25;Traumatismes multiples;Chirurgical;197;0
911;Procédure abdominale ou thoracique extensive pour polytraumatisme significatif;25;Traumatismes multiples;Chirurgical;214;< 5
912;Procédures musculo-squelettiques et autres pour polytraumatisme significatif;25;Traumatismes multiples;Chirurgical;1.218;< 5
930;Polytraumatisme significatif sans procédure opératoire;25;Traumatismes multiples;Médical;1.307;14
950;Procédure extensive sans relation avec le diagnostic principal;0;Groupe résiduel;Chirurgical;4.960;1.542
951;Procédure modérément étendue sans relation avec le diagnostic principal;0;Groupe résiduel;Chirurgical;13.535;3.675
952;Procédure non extensive sans relation avec le diagnostic principal;0;Groupe résiduel;Chirurgical;5.437;3.222
955;Diagnostic principal non valable comme diagnostic de sortie;0;Groupe résiduel;Autre;51;29
956;Séjour non groupable;0;Groupe résiduel;Autre;124;71
AAA;Psychiatrie (A, K, T);SS;DRG spéciaux;Autre;0;0
DDD;Enregistrement provisoire;SS;DRG spéciaux;Autre;0;0
MMM;Hospitalisation de jour;SS;DRG spéciaux;Autre;0;7.200
UAA;Service d'urgence en psychiatrie;SS;DRG spéciaux;Autre;0;0
UUU;Service d'urgence;SS;DRG spéciaux;Autre;0;0
XXX;Diagnostic factice;SS;DRG spéciaux;Autre;0;0
;;;;;1.829.201;1.971.935
